"date","text","controversiality"
"2020-11-07","I WON THIS ELECTION, BY A LOT!","165.09669633145958"
"2020-11-06","Joe Biden should not wrongfully claim the office of the President. \n I could make that claim also. \n Legal proceedings are just now beginning!","209.48815668283243"
"2020-11-05","STOP THE COUNT!","121.6149616909947"
"2020-11-04","I will be making a statement tonight. \n A big WIN!","158.6748174484862"
"2020-11-03","VOTE! VOTE! VOTE!\nhttps://t.co/85ySh1KYkh","559.5012371390178"
"2020-11-02","MAKE AMERICA GREAT AGAIN!","979.0406970844658"
"2020-11-01","I LOVE TEXAS! https://t.co/EP7P3AvE8L","798.9653941854647"
"2020-10-31","MAKE AMERICA GREAT AGAIN!","906.629668359273"
"2020-10-30","The Election should end on November 3rd., not weeks later!","871.2821136446005"
"2020-10-29","Our hearts are with the people of France. \n America stands with our oldest Ally in this fight. \n These Radical Islamic terrorist attacks must stop immediately. \n No country, France or otherwise can long put up with it!","455.1791536895909"
"2020-10-28","Why isn’t Twitter trending Biden corruption? It’s the biggest, and most credible, story anywhere in the world. \n Fake Trending!!!","565.9866201949432"
"2020-10-27","MAKE AMERICA GREAT AGAIN!","870.7584483078932"
"2020-10-26","MAKE AMERICA GREAT AGAIN!","365.0804353346969"
"2020-10-25","So important to VOTE for Republicans in the House. \n Break away from Pelosi and her high Taxing new Radical Left friends. \n Protect your 2nd Amendment, Military, Vets, and sooo much more!","482.18048252119894"
"2020-10-24","MAKE AMERICA GREAT AGAIN!","530.1888848736795"
"2020-10-23","Here you go @JoeBiden! https://t.co/UBqPJT85Pt","340.92600372568995"
"2020-10-22","Judiciary Committee approves Judge Barrett. \n Moves to full Senate for final vote. \n Big day for America!","403.04759479947137"
"2020-10-21","https://t.co/MO0tx94Ykn","488.4946872572103"
"2020-10-20","I am pleased to inform you that, for the sake of accuracy in reporting, I am considering posting my interview with Lesley Stahl of 60 Minutes, PRIOR TO AIRTIME! This will be done so that everybody can get a glimpse of what a FAKE and BIASED interview is all about...","131.1983757357509"
"2020-10-19","GREAT news! New government of Sudan, which is making great progress, agreed to pay $335 MILLION to U.S. \n terror victims and families. \n Once deposited, I will lift Sudan from the State Sponsors of Terrorism list. \n At long last, JUSTICE for the American people and BIG step for Sudan!","335.1893443101065"
"2020-10-18","Corrupt politician Joe Biden makes Crooked Hillary look like an amateur!","413.31405961530083"
"2020-10-17","GIANT RED WAVE COMING!","430.9134647427779"
"2020-10-16","Polls numbers are looking very strong. \n Big crowds, great enthusiasm. \n Massive RED WAVE coming!!!","356.4736376404559"
"2020-10-15","Pelosi is holding up STIMULUS, not the Republicans!","503.60750297537663"
"2020-10-14","https://t.co/wJN4zv0y8O","300.404923415305"
"2020-10-13","STIMULUS! Go big or go home!!!","650.5076968276406"
"2020-10-12","California is going to hell. \n Vote Trump!","886.7064763739908"
"2020-10-11","As the 1st President to formally recognize the issue of Missing & Murdered Native Americans, today, I was proud to sign Savanna’s Act & the Not Invisible Act. \n We have also provided $295 Million to support public safety & crime victims. \n Forgotten NO MORE! #OperationLadyJustice","309.4012287294208"
"2020-10-10","Joe Biden is a PUPPET of CASTRO-CHAVISTAS like Crazy Bernie, AOC and Castro-lover Karen Bass. \n Biden is supported by socialist Gustavo Petro, a major LOSER and former M-19 guerrilla leader. \n Biden is weak on socialism and will betray Colombia. \n I stand with you!","50.02095123364863"
"2020-10-09","Breaking News: 50,000 OHIO VOTERS getting WRONG ABSENTEE BALLOTS. \n Out of control. \n A Rigged Election!!!","401.3353672285044"
"2020-10-08","Mike Pence WON BIG!","422.71299896888706"
"2020-10-07","THE FAKE NEWS MEDIA IS THE REAL OPPOSITION PARTY!","763.0289980427755"
"2020-10-06","FEELING GREAT!","325.5138982295234"
"2020-10-05","I will be leaving the great Walter Reed Medical Center today at 6:30 P.M. \n Feeling really good! Don’t be afraid of Covid. \n Don’t let it dominate your life. \n We have developed, under the Trump Administration, some really great drugs & knowledge. \n I feel better than I did 20 years ago!","495.8290680550436"
"2020-10-04","I really appreciate all of the fans and supporters outside of the hospital. \n The fact is, they really love our Country and are seeing how we are MAKING IT GREATER THAN EVER BEFORE!","87.65553233349905"
"2020-10-03","Going welI, I think! Thank you to all. \n LOVE!!!","75.11037254524135"
"2020-10-02","Tonight, @FLOTUS and I tested positive for COVID-19. \n We will begin our quarantine and recovery process immediately. \n We will get through this TOGETHER!","56.343890057493695"
"2020-10-01","I won the debate big, based on compilation of polls etc. \n Thank you!","329.8435651697575"
"2020-09-30","https://t.co/HUSFkHqsyC","941.7126836830142"
"2020-09-29","Rigged Election! https://t.co/ysYCBCyxf8","276.53749094589125"
"2020-09-28","Joe Biden just announced that he will not agree to a Drug Test. \n Gee, I wonder why?","145.65639722378768"
"2020-09-27","I will be strongly demanding a Drug Test of Sleepy Joe Biden prior to, or after, the Debate on Tuesday night. \n Naturally, I will agree to take one also. \n His Debate performances have been record setting UNEVEN, to put it mildly. \n Only drugs could have caused this discrepancy???","221.4342499081402"
"2020-09-26","The Obama Administration was not out to get the facts, they were out to “get Trump”. \n Ken Starr...And got caught red handed - All of them. \n “Trump was right”, they said!","140.3871216595897"
"2020-09-25","Cheating on Unsolicited Ballots by political hacks, or anyone else, is against the law. \n We are closely watching!","321.2736917567792"
"2020-09-24","LAW & ORDER!","352.66987911617844"
"2020-09-23","Our GREAT RALLY tonight in Pennsylvania. \n Tremendous energy! #MAGA https://t.co/kL29rJe6sh","400.78445029024704"
"2020-09-22","I will be announcing my Supreme Court Nominee on Saturday, at the White House! Exact time TBA.","334.8435792905002"
"2020-09-21","I agree 100%. \n https://t.co/9lgiXcdlC5","138.68145770979913"
"2020-09-20","MAKE AMERICA GREAT AGAIN!","384.47556066330327"
"2020-09-19",".@GOP  We were put in this position of power and importance to make decisions for the people who so proudly elected us, the most important of which has long been considered to be the selection of United States Supreme Court Justices. \n We have this obligation, without delay!","49.95709386489972"
"2020-09-18","Pelosi wants to take 30 Billion Dollars away from our great Farmers. \n Can’t let that happen!","618.3926117397099"
"2020-09-17","Twitter makes sure that Trending on Twitter is anything bad, Fake or not, about President Donald Trump. \n So obvious what they are doing. \n Being studied now!","411.64746643774095"
"2020-09-16","Great News: BIG TEN FOOTBALL IS BACK. \n All teams to participate. \n Thank you to the players, coaches, parents, and all school representatives. \n Have a FANTASTIC SEASON! It is my great honor to have helped!!!","205.10164927938013"
"2020-09-15","Did you see where Joe Biden — as Weak, Tired, and Sleepy as he is, went to a Polling Place today in Delaware (of course!) to VOTE!? If Biden can do it, any American can do it!","311.9295885416191"
"2020-09-14","I do! https://t.co/H9Eghnqpuy","578.8024424071624"
"2020-09-13","I was right, these people were all wrong, and now they criticize me. \n Such hypocrisy! https://t.co/sztQ7h5T4M","73.42590358602324"
